菜谱名称,难度,口味,烹饪时间,食材,步骤
脆皮烧肉,初级入门,家常味,<90分钟,带皮五花肉900克小葱 10克姜片 10克八角 5克小苏打 10克香叶3克 盐6克花生油 5克糖 3克黑椒粉2克酒 6克 ,1.各材料 2.烧沸一锅水，把清洗好的带皮五花肉、小葱、八角、姜片、香叶投在锅，把五花肉煮煮表面变色，7成熟，就把肉捞出，晾去水分 3.在晾去水分的带皮五花肉上用几支牙签不断地扎下小孔，扎的时候斜斜的方向，不是垂直，目的让肉的皮烤好后会香脆点 4.把扎好小孔的五花肉翻过来，切成九宫格那样子，深度约是肉的2/3左右，然后把调味料盐、黑椒、糖、五香粉均匀地涂抹在肉里，可以适当按摩一下肉 5.把五花的白肉那面朝下腌1小时左右，皮的上面涂上小苏打，最好放在有风的地方，让皮吹至干爽，这样做烤出来的皮会很脆的 6.把腌好的肉用锡纸封好肉，皮要露出来，烤箱预热到200度，把处理好的肉放入，烤30分钟左右，再取出五花肉，在上面涂上花生油 7.再次把五花肉放烤箱内，上火调至200度，下火调180度，继续烤20分钟，这时候你可以看到肉皮表面往外冒油，并有泡泡状的东西突起，就是说脆皮这一项成功了 8.脆皮烧肉要出炉喽，不过先不要急着吃，要晾凉，皮才会脆脆的 
香烤猪蹄,初级入门,家常味,<30分钟,猪蹄 500克 料酒、生抽、老抽、盐、白糖适量葱、姜、蒜、干辣椒适量孜然粉、白芝麻、椒盐适量 ,1.猪蹄洗净，剁成块；锅中加入冷水，下入猪蹄、姜片、料酒。 2.煮沸后，撇去浮沫，煮至变色取出。 3.锅中适量食用油，放入八角、香叶、葱段、姜片、干辣椒爆香，再倒入猪蹄煸炒几分钟，直至猪皮起泡为止。 4.倒入没过猪蹄的水量，加入生抽、老抽、料酒、盐、白糖。 5.大火煮开后转小火炖90分钟左右。（如果用高压锅的话，大概时间30分钟左右。） 6.将烤盘上铺上锡纸，并在锡纸上抹上一层薄薄的油，防止烤的时候猪蹄会粘在锡纸上，放上煮好的猪蹄。 7.把烤盘放入提前预热好的烤箱中，上下火200度，定时20分钟。 8.带上隔热手套，拖出烤盘。 9.撒上孜然粉、熟的白芝麻、椒盐，再烤2分钟即可取出食用。 
超级好吃的烤肋排赶紧学起来,初级入门,家常味,<60分钟,猪肋排4根 小土豆200克  百里香2克  黑胡椒适量烤肉酱150克 大蒜3瓣 蜂蜜30克 橄榄油 20克辣椒碎适量 ,1.猪肋排4根 / 小土豆200g / 烤肉酱150g大蒜3瓣 / 蜂蜜30g / 橄榄油20g百里香2g / 黑胡椒适量 / 辣椒碎适量 2.大蒜切成小粒。 3.猪肋排上均匀涂抹烤肉酱和蒜粒，撒上一些黑胡椒。盖上保鲜膜，放进冰箱冷藏过夜。 4.土豆洗净切块，混合橄榄油、黑胡椒、辣椒碎、百里香，盖上保鲜膜，放进冰箱冷藏过夜。 5.将肋排放入铺好油纸的烤盘上，拿掉蒜粒。 6.将蜂蜜和剩余的烤肉酱混合均匀。 7.用刷子将混合好的蜂蜜和剩余烤肉酱在肋排上涂抹均匀后，放入烤箱。 8.设置上下管温度140度，时间30分钟左右。（普通烤箱需要提前预热，预热温度160度，烤制温度160度，时间30分钟左右。） 9.时间到后取出，换一张干净的油纸，肋排翻面。然后放上小土豆。肋排表面刷上酱料。 10.再次放入烤箱，设置上下管温度140度，时间30分钟左右。（普通烤箱需要提前预热，预热温度160度，烤制温度160度，时间30分钟左右。） 
自制蜜汁烤鸡翅根，外酥里嫩好吃到转圈圈,,香辣味,<30分钟,鸡翅根9个 辣椒粉10克生抽12克冠利红葡萄酒醋10克黑胡椒粉1克番茄酱5克白糖3克盐3克食用油12克 ,"1.鸡翅根清洗干净，晾干水份，在鸡翅根两面划两刀，方便腌制入味 2.准备佐料 3.鸡翅根放入容器里，加辣椒粉，生抽，冠利红葡萄酒醋，黑胡椒粉，番茄酱，白糖,盐，食用油带上一次性手套，抓均匀，盖上保鲜膜放进冰箱冷藏室腌制4小时以上 4.准备耐高温砂锅，铝箔纸，不锈钢支架 5.砂锅里放入不锈钢支架，在支架上铺铝箔纸，防止烤鸡翅根佐料滴露进砂锅里 6.鸡翅根均匀码入铝箔纸上 7.盖上锅盖中火烤20～25分钟左右（㊙️你们没有看错砂锅里不放一点水） 8.打开锅盖，在鸡翅表面刷一层蜂蜜，撒一点白芝麻（没有蜂蜜和芝麻，可以不用），盖上锅盖烤10分钟左右 9.把鸡翅翻面，再刷一层蜂蜜撒一点白芝麻，继续烤10分钟左右 "
烤土豆五花肉,,香辣味,<数小时,五花肉300克土豆1个油泼辣子适量 姜适量蒜适量油适量盐适量 ,1.五花肉，蒜姜 2.五花肉洗干净，切成厚片，生姜切丝，大蒜切末 3.切好的生姜大蒜放在五花肉上，用盐，酱油腌制五花肉2小时\n 4.土豆洗干净去皮，再切成薄片，用一点点油和盐腌一下 5. 烤盘上放入锡纸，把腌过的土豆片，一片一片的铺在锡纸上，然后再把腌制好的五花肉放在土豆片上，烤盘放入烤箱中层，上下火，200度，烤25分钟 6.在烤好后的五花肉上，浇上一点油泼辣子 
香菇肉丸,,家常味,<30分钟,香菇10个肉120克生姜30克大蒜25克生抽5克生粉3克玉米油适量盐适量 葱适量 ,1.生姜和大蒜切小丁 2.用适量开水浸泡，一会儿取汁用 3.小葱切碎 4.肉切小剁碎 5.生抽 生粉 姜蒜水 葱花 适量盐一起放进肉内 6.肉和调料拌均匀后，腌制着生抽 生粉 姜蒜水 葱花 适量盐一起放进肉内 7.开始洗香菇，洗干净，挤干水份后，去把 8.去把后的香菇像一个个小碗 9.香菇内外侧刷上薄薄的玉米油，抹上适量盐，不要太多了 10.烤盘内铺锡纸，处理好的香菇挨个摆入烤盘，烤箱200度预热 11.用勺子把肉馅儿放到香菇内 12.上下火200度烘烤20分钟 
蜜汁叉烧琵琶腿,新手尝试,其它口味,<60分钟,鸡腿820克 李锦记叉烧酱四勺蜂蜜（腌制）一勺耗油一勺蜂蜜（烤制）一勺蒜3瓣黑胡椒粉研磨五下 ,1.琵琶腿洗净，去除多余油脂，用牙签反正面扎n个眼，再反正面各切两刀方便入味 2.调腌料：四大勺叉烧酱，一勺蚝油，一勺蜂蜜，蒜蓉，黑胡椒一起拌匀 3.把鸡腿放入大点的食品袋里，倒入酱料，给鸡腿按摩几分钟后放冰箱冷藏至少腌制一晚，时间长点更好，期间再给鸡按摩两次最好 4.腌好后，鸡腿排放在烤架上，下层放铺了锡纸的烤盘，再给鸡腿刷层剩余酱汁，烤箱200度中层上下火35分钟。烤鸡腿时用剩余的酱汁两三勺加上一勺蜂蜜拌匀，鸡腿烤到20分钟时取出正反面都刷一遍酱汁，接着烤熟即可。 5.
土耳其沙玛威（烤肉）,初级入门,五香味,<60分钟,饼2片鸡腿1只薯条1份生菜1颗 肉桂粉适量柠檬半颗冰块1碗橄榄油3匙奶油适量孜然粉适量姜黄粉适量辣椒粉适量甜椒粉适量盐少许蒜粉适量黑胡椒少许蒜头适量 ,1.将鸡腿去骨，并用刀在鸡肉上交叉划网状，使其在后续步骤更入味。 2.鸡肉放到水晶碗里，在碗里倒入橄榄油、孜然粉、甜椒粉、蒜粉、辣椒粉、黑胡椒和盐。将鸡肉和所有调料充分拌匀，让肉的每一处都沾到调料。 3.将腌制好的鸡腿肉放到烤架上，在烤箱里用230度的温度烤15到20分钟。（鸡皮朝上） 4.将奶油打发，并加上适量蒜头和半颗柠檬汁拌匀。 5.薯条是炸好的，如果薯条因为放久了变软，就再放到锅里煸一下，使其变得脆一点。 6.将生菜用冰块冰镇备用，这样生菜会更脆。 7.将墨西哥饼在锅里热一下。（可以加一点点水，增加湿气，使其饼柔软） 8.将烤好的肉取出，切成细块状 9.在饼皮上依次铺上生菜、烤肉、薯条、奶油，再挤一点柠檬汁。（生菜记得沥干） 10.用饼皮将组装好的食材卷起来。完美！（想让食材包的更稳？请看下方小技巧❶） 
